tune/tune.txt
VERSION=8
#shouldUseFP16Storage
1
#shouldUseFP16Compute
0
#shouldUseFP16TensorCores
1
#xGemmDirect
WGD=16 MDIMCD=8 NDIMCD=8 MDIMAD=8 NDIMBD=8 KWID=1 VWMD=1 VWND=1 PADA=1 PADB=1
#xGemm
MWG=32 NWG=32 KWG=16 MDIMC=8 NDIMC=8 MDIMA=8 NDIMB=8 KWI=2 VWM=4 VWN=4 STRM=0 STRN=0 SA=1 SB=1
#xGemm16
MWG=32 NWG=32 KWG=16 MDIMC=8 NDIMC=8 MDIMA=8 NDIMB=8 KWI=2 VWM=4 VWN=4 STRM=0 STRN=0 SA=1 SB=1
#hGemmWmma
MWG=32 NWG=32 KWG=32 MWAVE=16 NWAVE=16 MWARP=16 NWARP=16 VWM=2 VWN=2 SA=0 SB=0
#conv3x3
INTILE_XSIZE=6 INTILE_YSIZE=6 OUTTILE_XSIZE=4 OUTTILE_YSIZE=4 transLocalSize0=64 transLocalSize1=1 untransLocalSize0=8 untransLocalSize1=4 untransLocalSize2=2
